<?xml version="1.0" encoding="UTF-8" ?>
<!DOCTYPE SecurePayMessage SYSTEM "request.dtd">

<!-- LOOK UP A TOKEN -->
<SecurePayMessage>

    <MessageInfo>
        <messageID>8af793f9af34bea0ecd7eff71a55f6</messageID>
        <messageTimestamp>20110710042843759000+600</messageTimestamp>
        <timeoutValue>60</timeoutValue>
        <apiVersion>spxml-3.0</apiVersion>
    </MessageInfo>

    <MerchantInfo>
        <merchantID>ABC00</merchantID>
        <password>abc123</password>
    </MerchantInfo>

    <RequestType>lookupToken</RequestType>
    <Token>
        <TokenList count="1">
            <TokenItem ID="1">
                <tokenValue>1234123412341234</tokenValue>
            </TokenItem>
        </TokenList>
    </Token>
    
</SecurePayMessage>