<?xml version="1.0" encoding="UTF-8" ?>
<!DOCTYPE SecurePayMessage SYSTEM "request.dtd">

<!-- STORING A CARD AS A PAYOR -->
<SecurePayMessage>

    <MessageInfo>
        <messageID>8af793f9af34bea0ecd7eff71b37ef</messageID>
        <messageTimestamp>20040710044409342000+600</messageTimestamp>
        <timeoutValue>60</timeoutValue>
        <apiVersion>spxml-3.0</apiVersion>
    </MessageInfo>

    <MerchantInfo>
        <merchantID>ABC0001</merchantID>
        <password>abc123</password>
    </MerchantInfo>

    <RequestType>Periodic</RequestType>
    <Periodic>
        <PeriodicList count="1">
            <PeriodicItem ID="1">
                <actionType>add</actionType>
                <clientID>test3</clientID>
                <CreditCardInfo>
                    <cardNumber>4444333322221111</cardNumber>
                    <cvv>123</cvv>
                    <expiryDate>09/25</expiryDate>
                </CreditCardInfo>
                <amount>1100</amount>
                <periodicType>4</periodicType>
            </PeriodicItem>
        </PeriodicList>
    </Periodic>

</SecurePayMessage>